{
  "$schema": "https://json-schema.org/draft/2020-12/schema",
  "$id": "health-metadata-iosxe/v5",
  "title": "health/metadata-iosxe.json",
  "description": "IOS-XE plane board (Kind metadata). Health Device only. Rewritten every health visit, including quiet visits. last_visit_id is the last stamp written; last_collected_at is the last completed collection. current[] is the last-known state of every subject and is what the next visit diffs against. Three row kinds: device (boot, version, cpu, memory), interface (oper state, flaps, errors, ACL bindings), bgp (session). A board row has the same shape as a stamp reading, minus note. No port, no host, no credentials. RESTCONF port stays on inventory/prod.json.",
  "type": "object",
  "additionalProperties": false,
  "required": ["keys", "schema", "updated_at", "source_agent", "iosxe"],
  "properties": {
    "keys": {
      "type": "array",
      "uniqueItems": true,
      "items": {"type": "string", "pattern": "^(device|interface|site|service|test|control|incident|change):[^ ].*$"},
      "description": "Union of every key on current[]."
    },
    "schema": { "type": "string", "const": "health-metadata-iosxe/v5" },
    "updated_at": { "type": "string", "minLength": 1 },
    "source_agent": { "type": "string", "const": "health-device" },
    "iosxe": {
      "type": "object",
      "additionalProperties": false,
      "required": ["last_visit_id", "last_collected_at", "baseline_visit_id", "current", "series", "visits"],
      "properties": {
        "last_visit_id": {
          "type": ["string", "null"],
          "pattern": "^[0-9]{4}-[0-9]{2}-[0-9]{2}T[0-9]{2}-[0-9]{2}-[0-9]{2}Z$",
          "description": "watch_id of the last stamp written. Unchanged on a quiet visit."
        },
        "last_collected_at": {
          "type": ["string", "null"],
          "description": "checked_at of the last completed collection, stamp or not. Per-device freshness: the latest visits[] row whose scope includes the device."
        },
        "baseline_visit_id": {
          "type": ["string", "null"],
          "pattern": "^[0-9]{4}-[0-9]{2}-[0-9]{2}T[0-9]{2}-[0-9]{2}-[0-9]{2}Z$",
          "description": "watch_id of the first-visit stamp (the one that listed every subject). Stamps point at it with baseline_ref."
        },
        "current": {
          "type": "array",
          "maxItems": 120,
          "items": { "$ref": "#/$defs/row" },
          "description": "One row per subject the last collection returned. device: one row per collected device. interface: physical, sub-interfaces, and Tunnel including admin-down; never Loopback*, Vlan*, Null*. bgp: every neighbor summary. Rows for a device outside this visit's scope, or whose collection failed, are kept as they were."
        },
        "series": {
          "type": "array",
          "maxItems": 10,
          "items": { "$ref": "#/$defs/metric_row" },
          "description": "One estate row per visit, oldest first: sums (or max, for cpu and memory) over the devices collected that visit. Per-device rows live on the stamp."
        },
        "visits": {
          "type": "array",
          "maxItems": 10,
          "items": { "$ref": "#/$defs/visit_row" },
          "description": "Last 10 visits, oldest first."
        }
      }
    }
  },
  "$defs": {
    "row": {
      "type": "object",
      "additionalProperties": false,
      "required": ["name", "kind", "subject", "keys", "state", "last_changed"],
      "description": "Same shape as a stamp reading, without note. Fields beyond the required six depend on kind.",
      "properties": {
        "name": { "type": "string", "minLength": 1, "description": "Device name as inventory/prod.json writes it." },
        "kind": { "type": "string", "enum": ["device", "interface", "bgp"] },
        "subject": { "type": "string", "minLength": 1, "description": "device: the device name again. interface: name as the device returns it. bgp: neighbor id." },
        "keys": {
          "type": "array",
          "minItems": 1,
          "maxItems": 16,
          "uniqueItems": true,
          "items": {"type": "string", "pattern": "^(device|interface|site|service|test|control|incident|change):[^ ].*$"},
          "description": "device:<name>; plus interface:<name>/<subject> on interface rows; plus the peer device key on a resolved bgp row."
        },
        "state": { "type": ["string", "null"], "description": "device: up (it answered). interface: oper-status as returned. bgp: state as returned." },
        "last_changed": { "type": "string", "minLength": 1, "description": "device: boot-time (reload only when moved more than 5s and corroborated). interface: interface last-change. bgp: checked_at of the visit that last saw a material field move (or first saw the row)." },
        "software_version": { "type": ["string", "null"], "description": "device: the token after 'Version ' in software-version, e.g. 17.15.1a." },
        "last_reboot_reason": { "type": ["string", "null"], "description": "device: as returned." },
        "reason_severity": { "type": ["string", "null"], "description": "device: normal or abnormal, as returned." },
        "cpu_5m": { "type": ["integer", "null"], "description": "device: five-minutes CPU percent." },
        "mem_used_pct": { "type": ["integer", "null"], "description": "device: round(used-memory / total-memory * 100) for the Processor pool." },
        "unsaved_config": { "type": ["boolean", "null"], "description": "device: as returned. Material only when the boolean flips. Running vs startup text is not collected." },
        "in_errors": { "type": ["integer", "null"] },
        "in_crc_errors": { "type": ["integer", "null"] },
        "in_discards": { "type": ["integer", "null"], "description": "interface: last seen. Recorded and summed on the metric; an increase alone is not material." },
        "num_flaps": { "type": ["integer", "null"] },
        "input_acl": { "type": ["string", "null"], "description": "interface: input-security-acl name, null when absent or empty string." },
        "output_acl": { "type": ["string", "null"] },
        "prefixes_received": { "type": ["integer", "null"] },
        "up_time": { "type": ["string", "null"], "description": "bgp: session uptime as returned. Shorter than the board's value is session re-establishment, not a device reboot." },
        "remote_as": { "type": ["integer", "null"] },
        "peer": { "type": ["string", "null"], "description": "bgp: device:<name> when the neighbor id equals an interface address of a device in inventory/prod.json (from this visit's interface payloads or inventory/topology-observed.json); else null." },
        "admin_status": { "type": ["string", "null"], "description": "interface: admin-status as returned." },
        "intent": { "type": ["string", "null"], "description": "interface: ok, failed, admin_disabled, provisioning, or unknown." },
        "reset_reason": { "type": ["string", "null"], "description": "bgp: connection.reset-reason from the keyed neighbor GET when not established." }
      }
    },
    "metric_row": {
      "type": "object",
      "additionalProperties": false,
      "required": ["at", "scope", "oper_not_ready", "bgp_not_established", "num_flaps", "in_errors", "in_discards", "cpu_5m_max", "mem_used_pct_max"],
      "properties": {
        "at": { "type": "string", "minLength": 1 },
        "scope": { "type": "string", "pattern": "^(estate|device:[^ ].*)$" },
        "oper_not_ready": { "type": ["integer", "null"], "description": "Required interfaces that failed: admin-up oper not ready, or an intended links[] cable that is admin-down." },
        "bgp_not_established": { "type": ["integer", "null"] },
        "num_flaps": { "type": ["integer", "null"], "description": "Sum over board interfaces." },
        "in_errors": { "type": ["integer", "null"], "description": "Sum of in_errors + in_crc_errors over board interfaces." },
        "in_discards": { "type": ["integer", "null"], "description": "Sum over board interfaces." },
        "cpu_5m_max": { "type": ["integer", "null"], "description": "Highest cpu_5m among collected devices (the device's own value on a device row)." },
        "mem_used_pct_max": { "type": ["integer", "null"] }
      }
    },
    "visit_row": {
      "type": "object",
      "additionalProperties": false,
      "required": ["watch_id", "checked_at", "status", "coverage", "delta", "stamp_written", "scope"],
      "properties": {
        "watch_id": { "type": ["string", "null"], "description": "The stamp id when one was written; null on a quiet visit." },
        "checked_at": { "type": "string", "minLength": 1 },
        "status": { "type": "string", "enum": ["ok", "degraded", "unknown"] },
        "coverage": { "type": "string", "enum": ["complete", "partial", "unavailable"] },
        "delta": { "type": "string", "enum": ["first", "unchanged", "worse", "better", "changed"], "description": "Same value as the visit's vs_prior.delta." },
        "stamp_written": { "type": "boolean" },
        "scope": {
          "type": ["array", "string"],
          "items": {"type": "string", "pattern": "^device:[^ ].*$"},
          "description": "\"all\" when every ranked device was collected; else the device keys the task line named."
        }
      }
    }
  }
}
