{
  "keys": ["device:<wan-device>", "interface:<wan-device>/<wan-interface>", "device:<edge-device>", "interface:<edge-device>/<edge-interface>", "interface:<edge-device>/<lan-interface>"],
  "schema": "health-metadata-iosxe/v5",
  "updated_at": "2026-08-31T22:00:00Z",
  "source_agent": "health-device",
  "iosxe": {
    "last_visit_id": "2026-08-31T16-00-00Z",
    "last_collected_at": "2026-08-31T22:00:00Z",
    "baseline_visit_id": "2026-08-30T09-00-00Z",
    "current": [
      {
        "name": "<wan-device>",
        "kind": "device",
        "subject": "<wan-device>",
        "keys": ["device:<wan-device>"],
        "state": "up",
        "last_changed": "2026-08-31T15:40:12Z",
        "software_version": "17.15.1a",
        "last_reboot_reason": "reload",
        "reason_severity": "abnormal",
        "cpu_5m": 2,
        "mem_used_pct": 12,
        "unsaved_config": false
      },
      {
        "name": "<wan-device>",
        "kind": "interface",
        "subject": "<wan-interface>",
        "keys": ["device:<wan-device>", "interface:<wan-device>/<wan-interface>"],
        "state": "if-oper-state-ready",
        "admin_status": "if-state-up",
        "intent": "ok",
        "last_changed": "2026-08-31T15:41:07Z",
        "in_errors": 0,
        "in_crc_errors": 0,
        "in_discards": 0,
        "num_flaps": 1,
        "input_acl": null,
        "output_acl": null
      },
      {
        "name": "<wan-device>",
        "kind": "bgp",
        "subject": "<neighbor-address>",
        "keys": ["device:<wan-device>", "device:<edge-device>"],
        "state": "fsm-established",
        "last_changed": "2026-08-31T16:00:00Z",
        "up_time": "06:18:50",
        "prefixes_received": 3,
        "remote_as": 65001,
        "peer": "device:<edge-device>"
      },
      {
        "name": "<edge-device>",
        "kind": "device",
        "subject": "<edge-device>",
        "keys": ["device:<edge-device>"],
        "state": "up",
        "last_changed": "2026-08-14T13:33:57Z",
        "software_version": "17.15.1a",
        "last_reboot_reason": "Reload Command",
        "reason_severity": "normal",
        "cpu_5m": 1,
        "mem_used_pct": 13,
        "unsaved_config": false
      },
      {
        "name": "<edge-device>",
        "kind": "interface",
        "subject": "<edge-interface>",
        "keys": ["device:<edge-device>", "interface:<edge-device>/<edge-interface>"],
        "state": "if-oper-state-ready",
        "admin_status": "if-state-up",
        "intent": "ok",
        "last_changed": "2026-08-31T15:41:09Z",
        "in_errors": 0,
        "in_crc_errors": 0,
        "in_discards": 0,
        "num_flaps": 1,
        "input_acl": null,
        "output_acl": null
      },
      {
        "name": "<edge-device>",
        "kind": "interface",
        "subject": "<lan-interface>",
        "keys": ["device:<edge-device>", "interface:<edge-device>/<lan-interface>"],
        "state": "if-oper-state-ready",
        "admin_status": "if-state-up",
        "intent": "ok",
        "last_changed": "2026-08-14T13:34:20Z",
        "in_errors": 0,
        "in_crc_errors": 0,
        "in_discards": 0,
        "num_flaps": 0,
        "input_acl": "<acl-name>",
        "output_acl": null
      }
    ],
    "series": [
      { "at": "2026-08-30T09:00:00Z", "scope": "estate", "oper_not_ready": 0, "bgp_not_established": 0, "num_flaps": 0, "in_errors": 0, "in_discards": 0, "cpu_5m_max": 2, "mem_used_pct_max": 13 },
      { "at": "2026-08-31T10:00:00Z", "scope": "estate", "oper_not_ready": 0, "bgp_not_established": 0, "num_flaps": 0, "in_errors": 0, "in_discards": 0, "cpu_5m_max": 1, "mem_used_pct_max": 13 },
      { "at": "2026-08-31T16:00:00Z", "scope": "estate", "oper_not_ready": 0, "bgp_not_established": 0, "num_flaps": 2, "in_errors": 0, "in_discards": 0, "cpu_5m_max": 4, "mem_used_pct_max": 13 },
      { "at": "2026-08-31T22:00:00Z", "scope": "estate", "oper_not_ready": 0, "bgp_not_established": 0, "num_flaps": 2, "in_errors": 0, "in_discards": 0, "cpu_5m_max": 2, "mem_used_pct_max": 12 }
    ],
    "visits": [
      { "watch_id": "2026-08-30T09-00-00Z", "checked_at": "2026-08-30T09:00:00Z", "status": "ok", "coverage": "complete", "delta": "first", "stamp_written": true, "scope": "all" },
      { "watch_id": null, "checked_at": "2026-08-31T10:00:00Z", "status": "ok", "coverage": "complete", "delta": "unchanged", "stamp_written": false, "scope": "all" },
      { "watch_id": "2026-08-31T16-00-00Z", "checked_at": "2026-08-31T16:00:00Z", "status": "degraded", "coverage": "complete", "delta": "worse", "stamp_written": true, "scope": "all" },
      { "watch_id": null, "checked_at": "2026-08-31T22:00:00Z", "status": "ok", "coverage": "complete", "delta": "unchanged", "stamp_written": false, "scope": ["device:<wan-device>"] }
    ]
  }
}
